{
  "slug": "metamask",
  "name": "MetaMask",
  "logoUrl": "./metamask.png",
  "category": "Wallet",
  "chains": [
    "Ethereum",
    "BNB Chain",
    "Polygon",
    "Arbitrum",
    "Optimism",
    "Avalanche",
    "Fantom"
  ],
  "tags": ["Wallet", "Browser Extension", "EVM", "Web3", "Crypto Wallet"],
  "pricing": "Free",
  "content": {
    "short": "A cryptocurrency wallet and gateway to blockchain apps.",
    "description": "MetaMask is a non-custodial cryptocurrency wallet that operates as a browser extension and mobile app. It allows users to store, send, and receive Ethereum and EVM-compatible tokens, and interact with decentralized applications (dApps) directly from their web browser. MetaMask serves as a crucial gateway to the decentralized web, providing secure key management and transaction signing capabilities.",
    "meta": "Manage your crypto, interact with dApps, and explore Web3 with MetaMask, the leading self-custodial wallet.",
    "pageTitle": "MetaMask - Browser Extension & Mobile Wallet"
  },
  "links": {
    "website": "https://metamask.io/",
    "github": "https://github.com/MetaMask",
    "twitter": "https://twitter.com/MetaMask",
    "docs": "https://docs.metamask.io/",
    "discord": "https://discord.gg/metamask"
  },
  "relations": {
    "alternatives": [],
    "related": ["uniswap", "opensea"]
  }
}
