{
  "slug": "wrong-slug",
  "name": "DApp 2",
  "logoUrl": "https://res.cloudinary.com/dksmzzvgs/image/upload/v1770619464/s1ggfydbfyccohxfiq9e.jpg",
  "category": "NFT",
  "chains": [
    "Polygon"
  ],
  "tags": [
    "Marketplace"
  ],
  "pricing": "Free",
  "content": {
    "short": "Short description for DApp 2",
    "description": "Full description for DApp 2",
    "meta": "SEO description for DApp 2",
    "pageTitle": "DApp 2 | DApp Store"
  },
  "links": {
    "website": "https://dapp2.com"
  },
  "relations": {
    "alternatives": [],
    "related": []
  },
  "source": {
    "fullyScraped": true
  }
}