{
  "slug": "opensea",
  "name": "OpenSea",
  "logoUrl": "./opensea.jpg",
  "category": "NFT",
  "chains": ["Ethereum", "Polygon", "Klaytn", "Arbitrum", "Optimism"],
  "tags": ["NFT Marketplace", "Collectibles", "Digital Art", "Gaming", "Web3"],
  "pricing": "Free",
  "content": {
    "short": "The world's first biggest and largest web3 marketplace for NFTs and crypto collectibles.",
    "description": "OpenSea is the leading peer-to-peer marketplace for NFTs (non-fungible tokens), crypto collectibles, and other digital assets. Users can buy, sell, and discover exclusive digital items, including art, gaming items, domain names, and virtual worlds. It supports a wide range of blockchains and asset types, making it a central hub for the NFT ecosystem.",
    "meta": "Explore, buy, and sell NFTs on OpenSea, the largest marketplace for crypto collectibles, digital art, and blockchain gaming items.",
    "pageTitle": "OpenSea - NFT Marketplace"
  },
  "links": {
    "website": "https://opensea.io/",
    "twitter": "https://twitter.com/opensea345",
    "discord": "https://discord.gg/opensea",
    "docs": "https://docs.opensea.io/"
  },
  "relations": {
    "alternatives": [],
    "related": ["uniswap"]
  }
}
