{
  "slug": "my-test-dapp",
  "name": "My Test DApp",
  "logoUrl": "./ethereum.jpg",
  "category": "Utility",
  "chains": ["Ethereum", "Polygon"],
  "tags": ["testing", "example"],
  "pricing": "Free",
  "content": {
    "short": "A short test description for my new dapp.",
    "description": "This is a detailed description for my new test dapp. It's used to verify the validation.",
    "meta": "SEO meta description for my new test dapp.",
    "pageTitle": "My Test DApp ethereum - Utility"
  },
  "links": {
    "website": "https://www.google.com",
    "github": "https://github.com",
    "twitter": "https://twitter.com/ethereum"
  },
  "relations": {
    "alternatives": [],
    "related": []
  }
}
